eng,gez
"Then Jesus called them to him and said, “Allow the children to come to me. Don’t forbid them, because God’s kingdom belongs to people like these children.",ወጸውዖሙ እግዚእ ኢየሱስ ወይቤሎሙ ኅድጉ ሕፃናተ ይምጽኡ ኀቤየ ወኢትክልእዎሙ እስመ ለዘከመ እሉ ይእቲ መንግሥተ እግዚአብሔር።
"Some time ago, Theudas appeared, claiming to be somebody, and some four hundred men joined him. After he was killed, all of his followers scattered, and nothing came of that.",ቀዲሙኒ እምቅድመዝ መዋዕል ተንሥአ ቴዎዳስ ዘግብጽ ወአዕበየ ርእሶ ወተለውዎ አርባዕቱ ምእት ሰብእ ወጠፍአ ውእቱኒ ወኵሎሙ እለ አምኑ ቦቱ ተዘርዉ ወኮኑ ከመ ዘኢተፈጥሩ።
"Then she put aside her widow’s clothing, put on a veil, made herself up, and sat down at the gate near the road to Timnah.",ወአንበረት አልባሰ ምዕስብናሃ ወለብሰት ግልባቤ ወተሠነየት ወነበረት ውስተ አንቀጽ እንተ መንገለ ፍኖተ ቴምናታ።
I trust in the Lord that I also will visit you soon.,ወእትአመን በእግዚእነ ከመ አነሂ ፍጡነ እመጽእ።
"Therefore shall ye observe all my statutes, and all my judgments, and do them: I am the LORD.",ወዕቀቡ ኵሎ ሕግየ ወኵሎ ትእዛዝየ ወግበርዎ እስመ አነ እግዚአብሔር ።
The chief priests decided that they would kill Lazarus too.,ወተማከሩ ሊቃነ ካህናት ከመ ይቅትልዎ ለአልዓዛር።
"Don’t behave like Cain, who belonged to the evil one and murdered his brother. And why did he kill him? He killed him because his own works were evil, but the works of his brother were righteous.Loving each other",ወአኮ በከመ ቃየን ዘእምእኩይ ውእቱ ወቀተሎ ለእኁሁ ወበእንተ ምንት ቀተሎ እስመ ምግባረ ዚኣሁ እኩይ ውእቱ ወዘእኁሁሰ ጻድቅ ውእቱ።
Perhaps it concerns this one statement that I blurted out when I was with them: ‘I am on trial before you today because of the resurrection of the dead.’”,ወአልቦ እኩይ ዘእንበለ አሐቲ ትምህርት ዘመሀርኩ ቀዊምየ በማእከሎሙ በብሂለ የሐይዉ ምዉታን ዘረከበኒ ዝ ተኰንኖ በኀቤከ ዮም።በእንተ አውሥኦተ ፊልክስ
and you don’t have his word dwelling with you because you don’t believe the one whom he has sent.,ወቃሉሂ አልብክሙ ወኢይነብር ኀቤክሙ እስመ ዘውእቱ ፈነወ ኪያሁ ኢአመንክሙ።
"And her husband went with her along weeping behind her to Bahurim. Then said Abner unto him, Go, return. And he returned.",ወትለዋ ምታ እስከ ብራቂ ወይቤሎ አበኔር ሖር ግባእ ወገብአ ።
"And the LORD spake unto Moses face to face, as a man speaketh unto his friend. And he turned again into the camp: but his servant Joshua, the son of Nun, a young man, departed not out of the tabernacle.",ወይትናገሮ እግዚአብሔር ለሙሴ ገጸ በገጽ ከመ ዘይትናገር ምስለ ዓርኩ ወይገብእ ውስተ ትዕይንት ወፅሙዱ ዮሳዕ ወልደ ነዌ ወንኡስ ውእቱ ወኢይወፅእ እምትዕይንት ።
"One law shall be to him that is homeborn, and unto the stranger that sojourneth among you.",አሐዱ ሕግ ይኩን ለሐቃል ወለግዩር ወለዘይመጽእ ኀቤክሙ ።
"The next day we sailed from there and arrived opposite Chios. On the day after, we sailed to Samos, and on the following day we came to Miletus.",ወእምህየ ነገድነ በሳኒታ ወበጻሕነ አንጢቅክስዩ ወበሳኒታ ኀለፍነ እንተ አሞን ወነበርነ ትሮጊሊዮም ወእምድኅረ ውእቱ ዕለት በጻሕነ መሊጡ።በእንተ በዓለ ጰንጠቈስጤ
"And the word of the LORD came unto him, saying,",ወኮነ ቃለ እግዚአብሔር ኀበ ኤልያስ ወይቤሎ ፤
"When Jesus finished these parables, he departed.",ወፈጺሞ እግዚእ ኢየሱስ እሎንተ ምሳሌያተ ተንሥአ እምህየ።
"And these are the names of the sons of Aaron; Nadab the firstborn, and Abihu, Eleazar, and Ithamar.",ወዝንቱ ውእቱ አስማቲሆሙ ለደቂቀ አሮን በኵሩ ናዳብ ወአቢዩድ ወእልዓዛር ወይታመር ።
"And he came to the sheepcotes by the way, where was a cave; and Saul went in to cover his feet: and David and his men remained in the sides of the cave.",ወነሥአ ምስሌሁ ሳኦል ፴፻ብእሴ ኅሩያነ እምነ ኵሉ እስራኤል ወሖረ ይኅሥሦ ለዳዊት ወለሰብኡ ኀበ ምንዓወ ህየላት ።
"And his father in law, the damsel's father, retained him; and he abode with him three days: so they did eat and drink, and lodged there.",ወአብኦ ሐሙሁ አቡሃ ለብእሲቱ ወነበረ ምስሌሁ ሠሉሰ መዋዕለ ወበልዑ ወሰትዩ ወቤተ ህየ ።
And he put the breastplate upon him: also he put in the breastplate the Urim and the Thummim.,ወወደየ ላዕሌሁ ልብሰ ሎግዮን ወወደየ ዲበ ሎግዮን ዘተአምር ወዘጽድቅ ።
"And David spake unto the LORD when he saw the angel that smote the people, and said, Lo, I have sinned, and I have done wickedly: but these sheep, what have they done? let thine hand, I pray thee, be against me, and against my father's house.",ወይቤሎ ዳዊት ለውእቱ መልአክ ሶበ ርእዮ እንዘ ይቀሥፎሙ ለሕዝብ ወይቤሎ ናሁ አነ ዘአበስኩ ወአነ ኖላዊ ዘገበርኩ እኩየ ወእሉ አባግዕ ምንተ ገብሩ ወትኩን እዴከ ላዕሌየ ወላዕለ ቤተ አቡየ ።
I considered keeping him with me so that he might serve me in your place during my time in prison because of the gospel.,ወፈቀድኩሰ አንብሮ ኀቤየ ከመ ይትለአከኒ ህየንቴከ በመዋቅሕትየ ዘበወንጌል።
"They sacrificed unto devils, not to God; to gods whom they knew not, to new gods that came newly up, whom your fathers feared not.",ወሦዑ ለአጋንንት ወአኮ ለእግዚአብሔር ፤ ለአማልክት እለ ኢያአምሩ ፤ አማልክተ ግብት እለ ኢይበቍዑ ፤ ወእለ ኢያአምሩ አበዊሆሙ ።
"Else, if thou wilt not let my people go, behold, I will send swarms of flies upon thee, and upon thy servants, and upon thy people, and into thy houses: and the houses of the Egyptians shall be full of swarms of flies, and also the ground whereon they are.",ወጸውዖሙ ፈርዖን ለሙሴ ወለአሮን ወይቤሎሙ ሑሩ ሡፁ ለአምላክክሙ በዛ ምድር ።
And it was in the heart of David my father to build an house for the name of the LORD God of Israel.,ወአኮ አንተ ዘተሐንጽ ቤትየ አላ ወልድከ ዘወፅአ እምነ ገበዋቲከ ውእቱ የሐንጽ ቤተ ለስምየ ።
"And he was an adversary to Israel all the days of Solomon, beside the mischief that Hadad did: and he abhorred Israel, and reigned over Syria.",ወኢዮርብዓም ብእሲ ጽኑዕ ውእቱ ወኀያል ወርእዮ ሰሎሞን ለውእቱ ወልድ ከመ ውእቱ ብእሲ ውስተ ግብር ወሤሞ ላዕለ አርሶስ በቤተ ዮሴፍ ።
"I know and I’m convinced in the Lord Jesus that nothing is wrong to eat in itself. But if someone thinks something is wrong to eat, it becomes wrong for that person.",ወአአምር፥ ወእትአመን በእግዚእነ ኢየሱስ ከመ አልቦ ዘይማስን በእንቲኣሁ ለሙሱን ዳእሙ ኵሉ ይማስን።
"And there they left their images, and David and his men burned them.",ወኀደጉ በህየ አማልክቲሆሙ ወነሥኦሙ ዳዊት ወሰብእ እለ ምስሌሁ ።
"They weren’t defiled with women, for these people who follow the Lamb wherever he goes are virgins. They were purchased from among humankind as early produce for God and the Lamb.",እለ ንጹሓን እሙንቱ እምአንስት በከመ ተወልዱ እሙንቱ እለ ተለውዎ ለበግዑ ኀበ ሖረ እለ ቀደሙ ተቤዝዎ እምነ ዕጓለ እመሕያው ለእግዚአብሔር ወለበግዑ።
Neither with you only do I make this covenant and this oath;,አላ ለእለሂ ሀለዉ ዝየ ዮም ምስሌክሙ ቅድመ እግዚአብሔር አምላክክሙ ወለእለሂ ኢሀለዉ ዝየ ምስሌክሙ ዮም ።
"Six days later Jesus took Peter, James, and John his brother, and brought them to the top of a very high mountain.",ወእምድኅረ ስሱ መዋዕል ነሥኦሙ እግዚእ ኢየሱስ ለጴጥሮስ ወለያዕቆብ ወለዮሐንስ እኁሁ ወአዕረጎሙ ደብረ ነዋኀ እንተ ባሕቲቶሙ።
"God is faithful, and you were called by him to partnership with his Son, Jesus Christ our Lord.Rival groups in Corinth",ጻድቅ እግዚአብሔር ዘጸውዐክሙ ትኩኑ ሱቱፋነ ወልዱ ኢየሱስ ክርስቶስ እግዚእነ።ዘከመ ኢይደሉ ተጋዕዞ
"If I give away everything that I have and hand over my own body to feel good about what I’ve done but I don’t have love, I receive no benefit whatsoever.",ወእመሂ ወሀብኩ ለምጽዋት ኵሎ ንዋይየ ወዓዲ ሥጋየኒ ለውዕየተ እሳት ወተፋቅሮ አልብየ አልቦ ዘረባሕኩ።
Zebulun shall dwell at the haven of the sea; and he shall be for an haven of ships; and his border shall be unto Zidon.,ዛቡሎን ሥኡኑ ይኅድር ከመ መርሶ አሕማር ወይስፋሕ እስከ ሲዶና ።
,ወመጽአ ሉስዮስ መልአክ ወአድኀኖ እምእደዊነ በብዙኅ ግብር ወፈነዎ ኀቤከ።
And that ye may teach the children of Israel all the statutes which the LORD hath spoken unto them by the hand of Moses.,ወትሜህሮሙ ለደቂቀ እስራኤል ኵሎ ሕገ ዘነገሮሙ እግዚአብሔር በእደ ሙሴ ።
And the thing was very grievous in Abraham's sight because of his son.,ወዕጹበ ኮኖ ዝንቱ ነገር በቅድሜሁ ለአብርሃም ጥቀ በእንተ ወልዱ ።
"And among these nations shalt thou find no ease, neither shall the sole of thy foot have rest: but the LORD shall give thee there a trembling heart, and failing of eyes, and sorrow of mind:",ወበህየኒ በውስተ ውእቱ አሕዛብ ኢያዐርፈከ ወኢያበውሐከ ትቁም እግርከ ወይሁበከ በህየ እግዚአብሔር ልበ ሕዙነ ወአዕይንተ ጥፉኣተ ወነፍሰ ምንሱተ ።
Then Pilate had Jesus taken and whipped.,ወእምዝ ነሥኦ ጲላጦስ ለእግዚእ ኢየሱስ ወቀሠፎ።
"By faith he lived in the land he had been promised as a stranger. He lived in tents along with Isaac and Jacob, who were coheirs of the same promise.",በተአምኖ ፈለሰ ወነበረ ብሔረ ዘአሰፈዎ ከመ ነኪር በሐይመታት ምስለ ይስሐቅ ወያዕቆብ እለ እሙንቱ ይወርስዋ ለተስፋሁ።
"They were all surprised and bewildered. Some asked each other, “What does this mean?”",ወደንገፁ ኵሎሙ ወኀጥኡ ዘይብሉ ወተባሀሉ በበይናቲሆሙ ምንትኑ እንጋ ዝ።
"By faith Moses was hidden by his parents for three months when he was born, because they saw that the child was beautiful and they weren’t afraid of the king’s orders.",በተአምኖ ተወሊዶ ሙሴ ኀብእዎ ሠለስተ አውራኀ በቤተ አበዊሁ እስመ ርእይዎ ከመ ሠናይ ውእቱ ሕፃን ወኢፈርሁ ትእዛዘ ንጉሥ።
"So Joshua blessed them, and sent them away: and they went unto their tents.",ወባረኮሙ ኢየሱስ ወፈነዎሙ ወአተዉ ውስተ አብያቲሆሙ ።
"The Lord smelled the pleasant fragrance and made a covenant with him that there would be no flood waters which would destroy the earth; (that) throughout all the days of the earth seedtime and harvest would not cease; (that) cold and heat, summer and winter, day and night would not change their prescribed pattern and would never cease.",ወአጼነወ እግዚአብሔር መዓዛ ሠናየ ወተካየደ ምስሌሁ ኪዳነ ከመ ኢይኩን ማየ አይኅ ዘያማስን ምድረ ኵሎ መዋዕለ ምድር ዘርእ ወማእረር ኢይትነተግ ደደክ ወመርቄ ሐጋይ ወክረምት ወመዓልት ወሌሊት ኢይወልጡ ሥርዓቶሙ ወኢይንተጉ ለዓለም።
Basketball star LeBron James buys a minority interest in Premier League team Liverpool Football Club.,ዘአጽፈሬዳ ተውኔት ኮከብ ለብሮን ጀምስ ገዝአ ዘፕሪሜየር ሊግ ንኡሰ ክፍለ።
"From that moment on, Pilate wanted to release Jesus.However, the Jewish leaders cried out, saying, “If you release this man, you aren’t a friend of the emperor! Anyone who makes himself out to be a king opposes the emperor!”",ወበእንተዝ ፈቀደ ጲላጦስ ያሕይዎ ወከልሑ አይሁድ ወይቤሉ እመ አሕየውኮ ለዝንቱ ኢኮንከ ዐርኮ ለቄሳር እስመ ኵሉ ዘያነግሥ ርእሶ ዐላዌ ነጋሢ ውእቱ።
This is the one who was in the assembly in the wilderness with our ancestors and with the angel who spoke to him on Mount Sinai. He is the one who received life-giving words to give to us.,ውእቱኬ ዘዐቀበ ተዓይኒሆሙ በገዳም ምስለ ውእቱ መልአክ ዘተናገሮ በደብረ ሲና ወዘተናገሮሙ ለአበዊነ ወውእቱ ዘተመጠወ ቃለ ሕይወት ከመ የሀበነ።
"Then the Jewish leaders asked him, “By what authority are you doing these things? What miraculous sign will you show us?”",ወአውሥእዎ አይሁድ ወይቤልዎ ምንተ ትእምርተ ታርኢ ዘዘንተ ትገብር።
"I tell you, this person went down to his home justified rather than the Pharisee. All who lift themselves up will be brought low, and those who make themselves low will be lifted up.”Jesus blesses children",ወእብለክሙ አተወ ቤቶ ዝንቱ እንዘ ይጸድቅ እምዝክቱ እስመ ኵሉ ዘአዕበየ ርእሶ የኀሥር ወዘአትሐተ ርእሶ ይከብር።ዘከመ ባረከ ሕፃናተ እግዚእ ኢየሱስ
"And I bowed down my head, and worshipped the LORD, and blessed the LORD God of my master Abraham, which had led me in the right way to take my master's brother's daughter unto his son.",ወሶበ አደመተኒ ሰገድኩ ለእግዚአብሔር ወአእኰትክዎ ለአምላከ አብርሃም ዘአውፅአኒ ውስተ ፍኖተ ጽድቅ ከመ እንሣእ ወለተ እኁሁ ለእግዚእየ ለወልዱ ።
"Or if a soul swear, pronouncing with his lips to do evil, or to do good, whatsoever it be that a man shall pronounce with an oath, and it be hid from him; when he knoweth of it, then he shall be guilty in one of these.",ወነፍስ እመ መሐለ ወነበበ በከናፍሪሁ ለገቢረ እኪት አው ለገቢረ ሠናይት በእንተ ኵሉ እምከመ ሰብእ መሐለ እንዘ ኢያአምር ወእምዝ ተዐውቆ ወአበሰ በአሐዱ እምዝንቱ ፤
"And thou shalt rejoice before the LORD thy God, thou, and thy son, and thy daughter, and thy manservant, and thy maidservant, and the Levite that is within thy gates, and the stranger, and the fatherless, and the widow, that are among you, in the place which the LORD thy God hath chosen to place his name there.",ወትትፌሣሕ በቅድመ አምላክከ አንተ ወደቂቅከ ወወለትከ ወገብርከ ወአመትከ ወሌዋዊ ዘውስተ ሀገርከ ወግዩር ወእጓለ ማውታ ወእቤር እንተ ኀቤክሙ ወእንተ ውስተ ውእቱ መካን ዘኀርየ እግዚአብሔር አምላክከ ከመ ይሰመይ ስሙ በህየ ።
"and put on the new nature, which is renewed in knowledge by conforming to the image of the one who created it.",ወልበስዎ ለሐዲስ ብእሲ ዘይትሔደስ በአእምሮ አምሳለ ፈጣሪሁ።
"And they went from Kehelathah, and pitched in mount Shapher.",ወግዕዙ እምነ መቄደት ወኀደሩ ውስተ አርሳፈር ።
"After this I looked, and there was a great crowd that no one could number. They were from every nation, tribe, people, and language. They were standing before the throne and before the Lamb. They wore white robes and held palm branches in their hands.",ወእምድኅረዝ ርኢኩ ሰብአ ብዙኃነ ዘአልቦ ዘይክል ኈልቆቶሙ እምነ ኵሉ ሕዝብ ወአሕዛብ ወነገድ ወበሐውርት ይቀውሙ ቅድመ መንበሩ ወቅድመ በግዑ ወይለብሱ አልባሰ ብሩሀ ወያጸንዑ ውስተ እደዊሆሙ ጸበርተ።
"“Silence!” Jesus said, speaking harshly to the demon. “Come out of him!”",ወገሠጾ እግዚእ ኢየሱስ ወይቤሎ ተፈፀም ወፃእ እምኔሁ።
Tunisian government and opposition leaders are deadlocked during talks over the determination of a new PM tasked with steering the country out of a months-long political crisis.,መንግስተ ቱኒዝያ መራህያነ ተቃዋምያን በሐዲስ ንጉሥ ለሀገር ዘአጎንደያ መጠነ ወርኅ እም ሁከተ ፖለተካ ለአውጽኦ በዘተውህበ ሥልጣነ በዘተእህዘ እስከ ናሁ እምከመተጋብኡ ይትረከቡበእጽው።
"In fact, I tell you that Elijah has come, but they did to him whatever they wanted, just as it was written about him.”A demon-possessed boy",ወባሕቱ እብለክሙ ኤልያስ ወድአ መጽአ ወገብሩ ላዕሌሁ ኵሎ ዘፈቀዱ በከመ ጽሑፍ በእንቲኣሁ።
"Peter responded, “Lord, I’m ready to go with you, both to prison and to death!”",ወይቤሎ እግዚኦ አንሰኬ ጥቡዕ ለሐዊር ምስሌከ ውስተ ኢየሩሳሌም እመኒ ለተሞቅሖ ወእመኒ ለመዊት።
"And the man, the master of the house, went out unto them, and said unto them, Nay, my brethren, nay, I pray you, do not so wickedly; seeing that this man is come into mine house, do not this folly.",ወወፅአ ኀቤሆሙ ዝክቱ ብእሲ ባዕለ ቤት ወይቤሎሙ ሐሰ ለክሙ አኀዊነ ኢትግበሩ እኩየ እምድኅረ ቦአ ብእሲ ውስተ ቤትየ ኢትግበሩ ዛተ እበደ ።
"For this reason the whole land of Shinar was named Babel because there God confused all the tongues of mankind. From there they were dispersed into their cities, each according to their languages and their nations.",በእንተዝ ተሰምየት ኵላ ምድረ ሰናኦር ባቤል እስመ በህየ ሦጠ አምላክ ኵሎ ልሳናቲሆሙ ለውሉደ ሰብእ ወእምህየ ተዘርዉ ውስተ አህጉሪሆሙ በበ ልሳናቲሆሙ ወበበ ሕዘቢሆሙ።
"And Eli blessed Elkanah and his wife, and said, The LORD give thee seed of this woman for the loan which is lent to the LORD. And they went unto their own home.",ወባረኮሙ ኤሊ ለሕልቃና ወለብእሲቱ ወይቤሎ ለይዕሲከ እግዚአብሔር ዘርአ እምነ ዛቲ ብእሲት ህየንተ ዝንቱ ዘአባእኮ ለእግዚአብሔር ወአተወ ውእቱ ብእሲ ብሔሮ ።
"All of this will happen to the evil generation which makes the earth commit sin through sexual impurity, contamination, and their detestable actions.",ወኵሉ ዝንቱ ይመጽእ በትውልድ እኪት እንተ ታኤብስ ምድረ በርኵሰ ዝሙት ወበግማኔ ወበሰቆራር ግብሮሙ።
"And Jonathan caused David to swear again, because he loved him: for he loved him as he loved his own soul.",ወይቤሎ ዮናታን ጌሠም ሠርቀ ወርኅ ወየኀሥሠከ በውስተ ምንባሪከ ።
"And upon whatsoever any of them, when they are dead, doth fall, it shall be unclean; whether it be any vessel of wood, or raiment, or skin, or sack, whatsoever vessel it be, wherein any work is done, it must be put into water, and it shall be unclean until the even; so it shall be cleansed.",ወኵሉ ውስተ ዘወድቀ በድኖሙ ርኩስ ውእቱ እምኵሉ ንዋየ ዕፅ አው ልብስ አው ማእስ አው ኀስል እምኵሉ ንዋይ ዘይገብሩ ቦቱ ግብረ ውስተ ማይ ይጠምዕዎ ወርኩስ ውእቱ እስከ ሰርክ ወእምዝ ንጹሕ ውእቱ ።
"When someone rejected the Law from Moses, they were put to death without mercy on the basis of the testimony of two or three witnesses.",ወለእመ ቦ ዘስሕተ እምኦሪተ ሙሴ እምከመ ክልኤቱ ወእመ አኮ ሠለስቱ ሰማዕት ዘለፍዎ ይመውት ወኢይምሕርዎ።
"Jesus boarded one of the boats, the one that belonged to Simon, then asked him to row out a little distance from the shore. Jesus sat down and taught the crowds from the boat.",ወዐርገ ውስተ አሐቲ ሐመር እምኔሆን ወይእቲ ሐመር እንተ ስምዖን ወይቤሎ ከመ ያርኅቃ ሕቀ እምነ ምድር ወነበረ ውስተ ሐመር ወመሀሮሙ ለሕዝብ።
"Soon afterward, the younger son gathered everything together and took a trip to a land far away. There, he wasted his wealth through extravagant living.",ወእምድኅረ ኅዳጥ መዋዕል አስተጋብአ ኵሎ ንዋዮ ዝኩ ወልዱ ዘይንእስ ወሖረ ወነገደ ርኁቀ ብሔረ ወበህየ ዘረወ ወአማሰነ ኵሎ ንዋዮ እንዘ የሐዩ በምርዓት።
"Nevertheless thou shalt not build the house; but thy son that shall come forth out of thy loins, he shall build the house unto my name.",ህየንተ ዳዊት አቡየ ወነበርኩ ላዕለ መንበረ እስራኤል በከመ ይቤ እግዚአብሔር ወሐነጽኩ ቤተ ለስመ እግዚአብሔር አምላከ እስራኤል ።
"Simon the Cananaean; and Judas, who betrayed Jesus.Commissioning of the Twelve",ወስምዖን ቀነናዊ ወይሁዳ አስቆሮታዊ ዘአግብኦ።
"And they came, both men and women, as many as were willing hearted, and brought bracelets, and earrings, and rings, and tablets, all jewels of gold: and every man that offered offered an offering of gold unto the LORD.",ወአምጽኡ ዕደው ዘእምኀበ አንስትኒ ኵሉ በከመ ፈቀዶ ልቡ ወአምጽኡ መኃትምተኒ ወአውጻበ ወሕለቃተ ወሐብለታተ ወአውቃፈ ወኵሎ ሰርጐ ዘወርቅ ።
"But the Jews became jealous and brought along some thugs who were hanging out in the marketplace. They formed a mob and started a riot in the city. They attacked Jason’s house, intending to bring Paul and Silas before the people.",ወቀንኡ አይሁድ ላዕሌሆሙ ወአስተጋብኡ ሰብአ ምሥያጥ ቢጸ እኩያነ ወበጽሑ ወሆክዋ ለሀገር ወኀሠሥዎሙ ወደበዩ ቤተ ኢያሶን ወፈቀዱ ያውፅእዎሙ ኀበ ሕዝብ።
"But I say to you, love your enemies and pray for those who harass you",ወአንሰ እብለክሙ አፍቅሩ ጸላእተክሙ ወባርክዎሙ ለእለ ይረግሙክሙ ወሠናየ ግበሩ ለእለ ይጸልኡክሙ ወጸልዩ በእንተ እለ ይትዔገሉክሙ ወይሰድዱክሙ።
"Peter sent everyone out of the room, then knelt and prayed. He turned to the body and said, “Tabitha, get up!” She opened her eyes, saw Peter, and sat up.",ወሰደደ ጴጥሮስ ኵሎ ወሰገደ ወጸለየ ወተመይጠ መንገለ በድና ወይቤላ ጣቢታ ተንሥኢ ወከሠተት አዕይንቲሃ ወሶቤሃ ርእየቶ ለጴጥሮስ ወነበረት።
"And Haran died before his father Terah in the land of his nativity, in Ur of the Chaldees.",ወሞተ አራን በኀበ ታራ አቡሁ በምድር እንተ በውስቴታ ተወልደ በምድረ ከላዴዎን ።
"Now the name of the Israelite that was slain, even that was slain with the Midianitish woman, was Zimri, the son of Salu, a prince of a chief house among the Simeonites.",ወስሙ ለውእቱ ብእሲ እስራኤላዊ ዘተቀትለ ዝንብሪ ወልደ ሐሎ መልአከ ቤተ አበዊሆሙ ዘስምዖን ።
"And I said unto them, Whosoever hath any gold, let them break it off. So they gave it me: then I cast it into the fire, and there came out this calf.",ወሶበ ርእየ ሙሴ ከመ ዐለዉ ሕዝብ ወአዕለዎሙ አሮን ወኮኑ ሣሕቀ ለጸላእቶሙ ፤
Those who don’t pick up their crosses and follow me aren’t worthy of me.,ዘኢያጥብዐ ወዘኢነሥአ መስቀለ ሞቱ ወዘኢተለወኒ ድኅሬየ ኢይደሉ ሊተ ወኢይክል ይፀመደኒ።
“Whoever welcomes one of these children in my name welcomes me; and whoever welcomes me isn’t actually welcoming me but rather the one who sent me.”Recognize your allies,ዘተወክፈ አሐደ ዘመጠነዝ ሕፃን በስምየ ኪያየ ተወክፈ ወዘኒ ኪያየ ተወክፈ አኮ ኪያየ ባሕቲቶ ዘተወክፈ ዘእንበለ ዘፈነወኒ።
