eng,gez
"Everyone who asks, receives. Whoever seeks, finds. To everyone who knocks, the door is opened.",እስመ ኵሉ ዘሰአለ ይነሥእ ወዘሂ ኀሠሠ ይረክብ ወለዘሂ ጐድጐደ ይትረኀዎ።
"And Abram said unto Lot, Let there be no strife, I pray thee, between me and thee, and between my herdmen and thy herdmen; for we be brethren.",ወይቤሎ አብራም ለሎጥ ኢይኩን ጋእዝ ማእከሌከ ወማእከሌየ ወማእከለ ኖሎትከ ወማእከለ ኖሎትየ እስመ አኀው ንሕነ ።
"After going a little farther, he saw James and John, Zebedee’s sons, in their boat repairing the fishing nets.",ወኀሊፎ እምህየ ሕቀ ረከቦሙ ለያዕቆብ ወለዮሐንስ እኁሁ ደቂቀ ዘብዴዎስ ወለሊሁኒ ምስሌሆሙ ውስተ ሐመር እንዘ ያስተሣንዩ መሣግሪሆሙ።
And the priest of his sons that is anointed in his stead shall offer it: it is a statute for ever unto the LORD; it shall be wholly burnt.,ኵሉ ተባዕት እምውስተ ካህናት ይበልዖ ቅዱስ ለቅዱሳን ውእቱ ዘእግዚአብሔር ።
"Of the children of Manasseh, by their generations, after their families, by the house of their fathers, according to the number of the names, from twenty years old and upward, all that were able to go forth to war;",ኍለቊሆሙ ዘእምነገደ ምናሴ ፫፻-፻፳፻፪፻ ።
"A voice told him, “Get up, Peter! Kill and eat!”",ወነበቦ ቃል ወይቤሎ ተንሥእ ጴጥሮስ ኅርድ ወብላዕ።
"At that very moment, a rooster crowed a second time. Peter remembered what Jesus told him, “Before a rooster crows twice, you will deny me three times.” And he broke down, sobbing.",ወተዘከረ ጴጥሮስ ቃሎ ለእግዚእ ኢየሱስ ዘይቤሎ ሥልሰ ትክሕደኒ ዘእንበለ ይንቁ ዶርሆ ክልኤ ጊዜ ወበከየ።
"But the children of Israel walked upon dry land in the midst of the sea; and the waters were a wall unto them on their right hand, and on their left.",ወውሉደ እስራኤል ሖሩ ውስተ ይብስት ባሕር ወባሕር አረፍተ ኮኖሙ እምይምን ወእምፅግም ።
"And ye shall eat neither bread, nor parched corn, nor green ears, until the selfsame day that ye have brought an offering unto your God: it shall be a statute for ever throughout your generations in all your dwellings.",ወይእተ ዕለተ እንተ ባቲ ታበውኡ ቍርባኖ ለአምላክክሙ ኢትብልዑ ኅብስተ ኀዲሰ ወኢቅልወ ኢትብልዑ እስከ ታበውኡ ቍርባኖ ለአምላክክሙ በይእቲ ዕለት ወሕገ ይኩንክሙ ዘለዓለም በመዋዕሊክሙ በኵሉ በሐውርቲክሙ ።
"And he made two chapiters of molten brass, to set upon the tops of the pillars: the height of the one chapiter was five cubits, and the height of the other chapiter was five cubits:",ወእደው ውስተ ውእቱ መንኰራኵር እኁዝ ዘሜከኖት ።
"And Ephron dwelt among the children of Heth: and Ephron the Hittite answered Abraham in the audience of the children of Heth, even of all that went in at the gate of his city, saying,",ወሀሎ ኤፌሮን ማእከሎሙ ይነብር ለደቂቀ ኬጢ ወይቤሎ ኤፌሮን ኬጥያዊ ለአብርሃም እንዘ ይሰምዑ ደቂቀ ኬጢ ወኵሎሙ እለ ይበውኡ ውስተ ሀገር ፤
"Paul and Barnabas stayed in Antioch, where, together with many others, they taught and proclaimed the good news of the Lord’s word.Paul and Barnabas part company",ወጳውሎስ ወበርናባስ ጐንደዩ አንጾኪያ ወመሀሩ ወሰበኩ ቃለ እግዚአብሔር ምስለ ባዕዳን ብዙኃን።በእንተ ሐውጾተ አኀው
"And David knew that Saul secretly practised mischief against him; and he said to Abiathar the priest, Bring hither the ephod.",ወአእመረ ዳዊት ከመ ኢያረምም ሳኦል በእንቲአሁ ለእኪት ወይቤሎ ዳዊት ለአብያታር ካህን አብእ ኤፉደ
"And the sons of Judah after their families were; of Shelah, the family of the Shelanites: of Pharez, the family of the Pharzites: of Zerah, the family of the Zarhites.",ወዘያሱብ ውስተ ነገደ ያሱብ ወዘስምራ ውስተ ነገደ ስምራሚ ።
"Then I fell at his feet to worship him. But he said, “Don’t do that! I’m a servant just like you and your brothers and sisters who hold firmly to the witness of Jesus. Worship God! The witness of Jesus is the spirit of prophecy!”Christ defeats the beast",ወወደቁ ኀበ እገሪሁ ወሰገድኩ ሎቱ ወይቤለኒ ዑቅ ዮጊ ኢትስግድ ሊተ እስመ አነሂ ገብር ዘከማከ ወዘምስሌከ ወምስለ አኀዊከ ነቢያት እለ የዐቅቡ ሕጎ ለኢየሱስ ወባሕቱ ለእግዚአብሔር ንስግድ ኵልነ እስመ ሕጉ ለኢየሱስ መንፈሰ ተነብዮ።በእንተ ፈረስ ጸዐዳ ወዘይጼዐኖ
Why? It’s because they didn’t go for it by faith but they went for it as if it could be reached by doing something. They have tripped over a stumbling block.,በእንተ ምንት እስመ ኢኮነ ጽድቆሙ በአሚን ዘእንበለ ዳእሙ በገቢረ ሕገገ ኦሪት ወአዕቀፈቶሙ እብነ ዕቅፍት።
"For great is the honor which the Lord has given Israel to eat, drink, and be filled on this festal day; and to rest on it from any work that belongs to the work of mankind except to burn incense and to bring before the Lord offerings and sacrifices for the days and the sabbaths.",እስመ ዐባይ ክብር እንተ ወሀበ እግዚአብሔር ለእስራኤል ለበሊዕ ወለሰቲይ ወለጸጊብ በዛቲ ዕለተ በዓል ወለአዕርፎ ባቲ እምኵሉ ግብር ዘእምግብረ እጓለ እመሕያው ዘእንበለ ዐጢነ ዕጣን ወለአብኦ ቍርባን ወመሥዋዕት ቅድመ እግዚአብሔር ለመዋዕል ወለሰንበታት።
I saw the Lord speaking to me. ‘Hurry!’ he said. ‘Leave Jerusalem at once because they won’t accept your testimony about me.’,ወርኢክዎ እንዘ ይብለኒ ፃእ ፍጡነ እምኢየሩሳሌም እስመ ኢይትዌከፉ ስምዐ ዚኣከ በእንቲኣየ።
"They looked, but there was none to save; even unto the LORD, but he answered them not.",ወእከይዶሙ ከመ ጽንጕነ ፍኖት ወእጠስዮሙ ።
"And they shall take away the ashes from the altar, and spread a purple cloth thereon:",ወመክደነሂ ያነብርዎ ውስተ ምሥዋዕ ወይከድኑ ላዕሌሁ ልብሰ ዘሕብረ ከብድ ኵለንታሁ ።
"The angel said, ‘Don’t be afraid, Paul! You must stand before Caesar! Indeed, God has also graciously given you everyone sailing with you.’",ወይቤለኒ ኢትፍራህ ጳውሎስ ሀለወከ ትቁም ቅድመ ቄሣር ወናሁ ጸገወከ እግዚአብሔር ኵሎሙ እለ ነገዱ ምስሌከ።
"They that are delivered from the noise of archers in the places of drawing water, there shall they rehearse the righteous acts of the LORD, even the righteous acts toward the inhabitants of his villages in Israel: then shall the people of the LORD go down to the gates.",ወሰንቅዉ ማእከለ ፍሡሓን ወበህየ ይሁቡ ጽድቀ ለእግዚአብሔር ወጽድቀ አጽንዐ በውስተ እስራኤል ወይእተ አሚረ ወረደ ውስተ አህጉሪሁ ሕዝበ እግዚአብሔር ።
"I heard a voice say, ‘Get up, Peter! Kill and eat!’",ወሰማዕኩ ቃለ ዘይቤለኒ ተንሥእ ጴጥሮስ ኅርድ ወብላዕ።
It wasn’t because of what was done but because of God’s call. This was said to her: “The older child will be a slave to the younger one”.,ከመ ያእምሩ ከመ ኢኮነ በምግባሩ ለሰብእ ዘእንበለ ዳእሙ ዘውእቱ ጸውዐ ወይቤላ ለርብቃ ዘየዐቢ ይትቀነይ ለዘይንእስ።
"And the LORD said unto Moses, Go unto the people, and sanctify them to day and to morrow, and let them wash their clothes,",ወይቤሎ እግዚአብሔር ለሙሴ ወሪደከ ኰንን ሕዝበ ወያንጽሑ ርእሶሙ ዮም ወጌሠመ ወይኅፅቡ አልባሲሆሙ ።
"And there went out fire from the LORD, and devoured them, and they died before the LORD.",ወወፅአት እሳት እምኀበ እግዚአብሔር ወበልዐቶሙ ወሞቱ በቅድመ እግዚአብሔር ።
"and I saw a beast coming up out of the sea. It had ten horns and seven heads. Each of its horns was decorated with a royal crown, and on its heads were blasphemous names.",ወወፅአ ካልእ አርዌ እምነ ባሕር ዘዐሠርቱ አቅርንቲሁ ወሰብዐቱ አርእስቲሁ ወውስተ አቅርንቲሁ ዐሠርቱ ቀጸላ ወውስተ አርእስቲሁ ስመ ፅርፈት።
"Arise, walk through the land in the length of it and in the breadth of it; for I will give it unto thee.",ዕርግ ወዑዳ ለይእቲ ምድር ውስተ ኑኀ ወርሕባ እስመ ለከ እሁባ ።
"And the LORD said unto Gideon, The people are yet too many; bring them down unto the water, and I will try them for thee there: and it shall be, that of whom I say unto thee, This shall go with thee, the same shall go with thee; and of whomsoever I say unto thee, This shall not go with thee, the same shall not go.",ወይቤሎ እግዚአብሔር ለጌድዮን ዓዲ ብዙኅ ሕዝብ አውርዶሙ ኀበ ማይ ወኣመክሮሙ ለከ በህየ ወእለ አነ እቤለከ እሙንቱ ይሑሩ ምስሌከ ።
"And the LORD shall scatter you among the nations, and ye shall be left few in number among the heathen, whither the LORD shall lead you.",ወይዘርወክሙ እግዚአብሔር ውስተ ኵሉ አሕዛብ ወትተርፉ ውኁዳነ በኍልቍ ውስተ አሕዛብ እለ ውስቴቶሙ ያበውአክሙ እግዚአብሔር ህየ ።
"Unto the place of the altar, which he had made there at the first: and there Abram called on the name of the LORD.",ውስተ መካን ኀበ ገብረ ምሥዋዐ ህየ ቀዲሙ ወጸውዐ አብራም ስመ እግዚአብሔር በህየ ።
"When they came to Capernaum, the people who collected the half-shekel temple tax came to Peter and said, “Doesn’t your teacher pay the temple tax?”",ወበጺሖ ቅፍርናሆም መጽኡ እለ ጸባሕተ ዲናር ይነሥኡ ኀበ ጴጥሮስ ወይቤልዎ ሊቅክሙሰ ኢይሁብኑ ጸባሐተ።
"Also, let’s hold on to the confession since we have a great high priest who passed through the heavens, who is Jesus, God’s Son;",ወብነ ሊቀ ካህናት ዐቢይ ኢየሱስ ክርስቶስ ወልደ እግዚአብሔር ዘተለዐለ እምሰማያት ናጽንዕ እንከ አሚነ ቦቱ።
"Then died Ibzan, and was buried at Bethlehem.",ወሞተ ሔሴቦን ወተቀብረ ውስተ ቤተ ልሔም ።
"“Be careful that you don’t practice your religion in front of people to draw their attention. If you do, you will have no reward from your Father who is in heaven.",ወባሕቱ ዑቁ ምጽዋተክሙ ኢትግበሩ ለዐይነ ሰብእ ከመ ታስተርእዩ ሎሙ ወእመ አኮሰ ዐስብ አልብክሙ በኀበ አቡክሙ ዘበሰማያት።
"And they said, Should he deal with our sister as with an harlot?",ወይቤልዎ ለምንትኬ ከመ ዘማ ረሰይዋ ለእኅትነ ።
"(Now the Amalekites and the Canaanites dwelt in the valley.) To morrow turn you, and get you into the wilderness by the way of the Red sea.",ወዐማሌቅ ወከናአን ንቡራን ውስተ ቈላተ አውርዮን ፤ ወአንትሙሰ ገዐዙ ወግብኡ ውስተ ገዳም ዘፍኖተ ባሕረ ኤርትራ ።
"And he went on his journeys from the south even to Bethel, unto the place where his tent had been at the beginning, between Bethel and Hai;",ወገብአ እምኀበ ወፅአ ውስተ ሐቅል ውስተ ቤቴል ውስተ መካን ኀበ ሀሎ ቀዲሙ ዐጸዱ ማእከለ ቤቴል ወማእከለ ሐጌ ።
"And the servant answered Saul again, and said, Behold, I have here at hand the fourth part of a shekel of silver: that will I give to the man of God, to tell us our way.",ወይቤሎ ዳግመ ዝክቱ ወልድ ለሳኦል ናሁ ብየ ኀቤየ ራብዕተ እዴሃ ለሰቅለ ብሩር ወትሁቦ ለብእሴ እግዚአብሔር ወይነግረነ ፍኖተነ ።
"And he shall offer of the sacrifice of the peace offering an offering made by fire unto the LORD; the fat thereof, and the whole rump, it shall he take off hard by the backbone; and the fat that covereth the inwards, and all the fat that is upon the inwards,",ወይነሥእ እምውስተ መሥዋዕተ መድኀኒት ቍርባነ ለእግዚአብሔር ሥብሐ ወሐቌሁ ንጹሐ ምስለ ስመጢሁ ይመትሮ ወኵሎ ሥብሐ ዘይገለብባ ለከርሡ ወኵሎ ሥብሐ ዘውስተ ከርሡ ፤
"If I have the gift of prophecy and I know all the mysteries and everything else, and if I have such complete faith that I can move mountains but I don’t have love, I’m nothing.",ወእመኒ ተነበይኩ ወአእመርኩ ኵሎ ዘኅቡእ ወኵሎ ጥበበ ወእመኒ ብየ ኵሉ ሃይማኖት እስከ አፈልስ አድባረ ወተፋቅሮ አልብየ ከንቶ ኮንኩ።
Now you know what holds him back so that he can be revealed when his time comes.,ወይእዜኒ ተአምሩ ዘይከልኦ አስተርእዮ እስከ ይበጽሕ ዕድሜሁ።
"This is the thing which the LORD hath commanded, Gather of it every man according to his eating, an omer for every man, according to the number of your persons; take ye every man for them which are in his tents.",ዝውእቱ ቃል ዘይቤ እግዚአብሔር አስተጋብኡ እምውስቴቱ በንዋይክሙ ለለ ብእሲ በበ ኍልቈ ሰብኡ ለለርእሱ በንዋዩ ለያስተጋብእ ።
"But every man's servant that is bought for money, when thou hast circumcised him, then shall he eat thereof.",ወኵሉ ገብር ዘኮነ ወዘበሤጥ ትገዝርዎ ወይእተ ጊዜ ይበልዕ እምኔሁ ።
"To God’s church that is in Corinth:To those who have been made holy to God in Christ Jesus, who are called to be God’s people.Together with all those who call upon the name of our Lord Jesus Christ in every place—he’s their Lord and ours!",ለማኅበረ እግዚአብሔር ዘብሔረ ቆሮንቶስ እለ ተቀደሱ በኢየሱስ ክርስቶስ ወተሰምዩ ቅዱሳነ ወለኵሎሙ እለ ይጼውዑ ስሞ ለእግዚእነ ኢየሱስ ክርስቶስ ውስተ ኵሉ በሐውርቲሆሙ ወለነሂ ምስሌሆሙ።
"But on the other hand, there will be wrath and anger for those who obey wickedness instead of the truth because they are acting out of selfishness and disobedience.",ወለእለሰ ከሓድያን ወዓላውያነ ጽድቅ ወመፍቀርያነ ዐመፃ ፍዳሆሙ መቅሠፍት ወመንሱት።
"Blessed shall be the fruit of thy body, and the fruit of thy ground, and the fruit of thy cattle, the increase of thy kine, and the flocks of thy sheep.",ቡሩከ ይከውን ፍሬ ከርሥከ ወቡሩከ ይከውን እክለ ምድርከ ወአዕጻደ ላህምከ ወመራዕየ አባግዒከ ።
"Whoever serves me must follow me. Wherever I am, there my servant will also be. My Father will honor whoever serves me.",ወእመቦ ዘይትለአከኒ ሊተ ለይትልወኒ እስመ ኀበ ሀሎኩ አነ ህየ ይሄሉ ዘይትለአከኒ ወለዘሊተ ተልእከኒ ያከብሮ አቡየ።
"They came into Jerusalem. After entering the temple, he threw out those who were selling and buying there. He pushed over the tables used for currency exchange and the chairs of those who sold doves.",ወበጽሐ ኢየሩሳሌም ወቦአ ቤተ መቅደስ ወአኀዘ ይስድድ እለ ይሠይጡ ወይሣየጡ በምኵራብ ወገፍትዐ ማእዳቲሆሙ ለመወልጣን ወመናብርቲሆሙ ለእለ ይሠይጡ ርግበ።
And there was no water for the congregation: and they gathered themselves together against Moses and against Aaron.,ወኦልቦቱ ማየ ለትዕይንት ወተጋብኡ ላዕለ ሙሴ ወላዕለ አሮን ።
"One golden spoon of ten shekels, full of incense:",ወጻሕል ፩ዘ፲ወርቁ ወምሉእ ዕጣነ ።
"Thou therefore, and thy sons, and thy servants, shall till the land for him, and thou shalt bring in the fruits, that thy master's son may have food to eat: but Mephibosheth thy master's son shall eat bread alway at my table. Now Ziba had fifteen sons and twenty servants.",ወተገበር ሎቱ ምድር አንተ ወደቂቅከ ወነባሪከ ወአእትዉ ለወልደ እግዚእክሙ እክሎ ወተሴሰይዎ አንትሙ ወሜንፎብስቴ ወልደ እግዚእከ ይብላዕ እክለ ዘልፈ በውስተ ማእድየ ፤ ወቦ ሲባ ፲ወ፭ደቂቀ ወ፳አግብርተ ።
"And the LORD met Balaam, and put a word in his mouth, and said, Go again unto Balak, and say thus.",ወተራከቦ እግዚአብሔር ለበለዓም ወወደየ ቃለ ውስተ አፉሁ ወይቤሎ ግባእ ኀበ በላቅ ወከመዝ በል ።
"After Adat died, Saloman who was from Emaseqa became king in his place.",ወሞተ አዳት ወነግሠ ህየንቴሁ ሰሎማን ዘእምነ እማሴቃ።
How terrible it will be at that time for women who are pregnant or for women who are nursing their children. There will be great agony on the earth and angry judgment on this people.,ወባሕቱ አሌ ሎን ለፅኑሳት ወለእለ የሐፅና በውእቱ መዋዕል እስመ ይከውን ዐቢይ ምንዳቤ ዲበ ምድር ወመቅሠፍት ዲበ ዝንቱ ሕዝብ።
"The city had God’s glory. Its brilliance was like a priceless jewel, like jasper that was as clear as crystal.",ወስብሐተ እግዚአብሔር ላዕሌሃ ወከዋክብቲሃኒ ይመስሉ ከመ ዕንቍ ክቡር ወጽዕዱት ይእቲ ከመ ባሕርይ።
"And when they of Ashdod arose early on the morrow, behold, Dagon was fallen upon his face to the earth before the ark of the LORD. And they took Dagon, and set him in his place again.",ወጌሡ ሰብአ አዛጦን ወቦኡ ቤተ ዳጎን ወረከብዎ ለዳጎን ውዱቀ በገጹ ውስተ ምድር ቅድመ ታቦተ እግዚአብሔር ወአንሥእዎ ለዳጎን ወአቀምዎ ውስተ መካኑ ።
"A widow, or a divorced woman, or profane, or an harlot, these shall he not take: but he shall take a virgin of his own people to wife.",መበለተ ባሕቱ ወውፃአ ወፅእለት ወዘማ እላንተ ክመ እለ ኢያወስብ አላ ድንግለ እንተ እምነገዱ ይነሥእ ሎቱ ብእሲተ ።
"And the king of Israel said unto his servants, Know ye that Ramoth in Gilead is ours, and we be still, and take it not out of the hand of the king of Syria?",ወይቤሎሙ ንጉሠ እስራኤል ለደቁ ታአምሩኑ ከመ እንቲአነ ይእቲ ሬማት እንተ ገለዓድ ወናርምም ንሕነሰ ከመ ኢንንሣእ እምእዴሁ ለንጉሠ ሶርያ ።
"Jesus was teaching daily in the temple. The chief priests, the legal experts, and the foremost leaders among the people were seeking to kill him.",ወኵሎ አሚረ ይሜህሮሙ በምኵራብ ወየኀሥሡ ሊቃነ ካህናት ወጸሐፍት ወሊቃናተ ሕዝብ በዘይቀትልዎ።
"Every beast, every creeping thing, and every fowl, and whatsoever creepeth upon the earth, after their kinds, went forth out of the ark.",ወኵሉ አራዊት ወእንስሳ ወአዕዋፋት ወኵሉ ዘይትሐወስ ዲበ ምድር በበዘመዶሙ ወወጽኡ እምነ ታቦት ።
"And Kinah, and Dimonah, and Adadah,",ወቃዴስ ወአስሪዮኔም ወሚናን ።
"But as truly as I live, all the earth shall be filled with the glory of the LORD.",አላ ሕያው አነ ወሕያው ስምየ ወይመልእ ስብሐቲሁ ለእግዚአብሔር ኵሎ ምድረ ፤
"Ur, Kesed’s son, built the city of Ara of the Chaldeans. He named it after himself and his father.",ወሐነጸ ኡድ ወልደ ኬሴድ ሀገረ አራሃ እንተ ከልዴዎን ወሰመየ ስማ በስመ ዚአሁ ወበስመ አቡሁ።
"Ananias went to the house. He placed his hands on Saul and said, “Brother Saul, the Lord sent me—Jesus, who appeared to you on the way as you were coming here. He sent me so that you could see again and be filled with the Holy Spirit.”",ወሶቤሃ ሖረ ሐናንያ ወቦአ ቤቶ ወወደየ እዴሁ ዲቤሁ ወይቤሎ ሳውል እኁየ ፈነወኒ ኀቤከ እግዚእነ ኢየሱስ ክርስቶስ ዘአስተርአየከ በፍኖት እንዘ ትመጽእ ከመ ትርአይ ወይምላእ መንፈስ ቅዱስ ላዕሌከ።
"And when he came, lo, Eli sat upon a seat by the wayside watching: for his heart trembled for the ark of God. And when the man came into the city, and told it, all the city cried out.",ወበጽሐ ወናሁ ኤሊይነብር ውስተ መንበር ኀበ ኆኅተ አንቀጽ ወይኔጽር መንገለ ፍኖት እስመ ይትሐዘብ ልቡ በእንተ ታቦተ እግዚአብሔር ፤ ወቦአ ውእቱ ብእሲ ውስተ ሀገር ወዜነወ ወጸርኀት ሀገር ።
"And God said unto Noah, The end of all flesh is come before me; for the earth is filled with violence through them; and, behold, I will destroy them with the earth.",ወይቤሎ እግዚአብሔር አምላኩ ለኖኅ ጊዜሁ ለእጓለ እመሕያው በጽሐ ቅድሜየ እስመ መልአ ዐመፃ ዲበ ምድር እምኔሆሙ ወናሁ አነ እደመስሶሙ ወለምድርኒ ።
"During the seventh week, in the first year during the first month — on the twelfth of this month — in this jubilee [2003], there were voices in heaven regarding Abraham, that he was faithful in everything that he told him, (that) the Lord loved him, and (that) in every difficulty he was faithful.",ወኮነ በሱባዔ ሳብዕ በቀዳሚ ዓመት በወርኅ ቀዳሚ በዝ ኢዮቤልዉ አመ ዐሡሩ ወሰኑዩ ለዝ ወርኅ ኮነ ቃላት በሰማያት በእንተ አብርሃም ከመ ውእቱ መሀይምን በኵሉ ዘይትናገሮ ወያፈቅሮ እግዚአብሔር ወበኵሉ ምንዳቤ ኮነ ምእመነ።
"So the attitude that comes from selfishness is hostile to God. It doesn’t submit to God’s Law, because it can’t.",እስመ ኅሊናሁ ለነፍስትነ ፀሩ ለእግዚአብሔር ውእቱ እስመ ኢይገርር ለሕገ እግዚአብሔር ወኢሂ ይክሎ።
"People can tame and already have tamed every kind of animal, bird, reptile, and fish.",እስመ ኵሉ ፍጥረተ አራዊትኒ ወአዕዋፍኒ ወዘይትሐወስኒ ውስተ ባሕር ወእንስሳኒ ይገርር ለፍጥረተ ዕጓለ እመሕያው።
"That they gathered themselves together, to fight with Joshua and with Israel, with one accord.",ወገብሩ እሙንቱሂ በጕሕሉት ወመጽኡ ሠኒቆሙ ወአስተዳሊዎሙ ወጾሩ መሣንቀ ብሉየ ዲበ መታክፊሆሙ ወዝቀ ወይን ብሉየ ወሥጡጠ ወጥቁበ ።
You can’t drink the cup of the Lord and the cup of demons; you can’t participate in the table of the Lord and the table of demons.,ወኢትክሉ ሰቲየ ጽዋዐ እግዚአብሔር ወጽዋዐ አጋንንት ወኢትክሉ በሊዐ ማእደ እግዚአብሔር ወማእደ አጋንንት።
"He sat down, called the Twelve, and said to them, “Whoever wants to be first must be least of all and the servant of all.”",ወነበረ ወጸውዖሙ ለዐሠርቱ ወክልኤቱ ወይቤሎሙ ዘይፈቅድ ይኩን ሊቀ ለያትሕት ርእሶ ለኵሉ ወይኩን ላእከ ለኵሉ።
"And Amasa wallowed in blood in the midst of the highway. And when the man saw that all the people stood still, he removed Amasa out of the highway into the field, and cast a cloth upon him, when he saw that every one that came by him stood still.",ወሶበ ርእየ ውእቱ ብእሲ ከመ ይቀውም ኵሉ ሕዝብ አግኀሦ ለአሜሳይ እምነ ፍኖት ውስተ ገዳም ወከደኖ አልባሰ ሶበ ርእየ ካመ ኵሉ ዘመጽአ ላዕሌሁ ይቀውም መልዕልቶ ።
"“Write this to the angel of the church in Laodicea:These are the words of the Amen, the faithful and true witness, the ruler of God’s creation.",ወጸሐፍ ሎቱ ለመልአከ ቤተ ክርስቲያን ዘሎዶቅያ ከመዝ ይቤ ዘውእቱ አሚን ወውእቱ ስምዕ መሃይምን ወጻድቅ ወውእቱ እምቅድመ ኵሉ ዘፈጠረ እግዚአብሔር።
And he set three days' journey betwixt himself and Jacob: and Jacob fed the rest of Laban's flocks.,ወርሕቀ ምሕዋረ ሠሉስ ማእከሎሙ ወማእከለ ያዕቆብ ወያዕቆብሰ ይሬዒ አባግዐ ላባ ዘተርፈ ።
How shall I not do what you have ordered me — that I should honor my father and brother?,ወእፎ ኢይግብር ነገረ ዘአዘዝክኒ ከመ አክብር አባየ ወእኅዋየ።
