eng,gez
"When he summoned his children, they came to him — they and their children. He divided the earth into the lots which his three sons would occupy. They reached out their hands and took the book from the bosom of their father Noah.",ወጸውዐ ደቂቆ ወቀርቡ ኀቤሁ እሙንቱ ወውሉዶሙ ወከፈለ ምድረ በዑፃዌ ዘይእኅዙ ሠለስቲሆሙ ውሉዱ ወሰፍሑ እደዊሆሙ ወነሥኡ መጽሐፈ እምሕፅነ ኖኅ አቡሆሙ።
"And it came to pass, when Pharaoh would hardly let us go, that the LORD slew all the firstborn in the land of Egypt, both the firstborn of man, and the firstborn of beast: therefore I sacrifice to the LORD all that openeth the matrix, being males; but all the firstborn of my children I redeem.",አመ አበየ ፈርዖን ፈንዎተነ ቀተለ ኵሎ በኵረ በምድረ ግብጽ እምበኵረ ሰብእ እስከ እንስሳ ወበእንተዝ አነ እሠውዕ ለእግዚአብሔር ኵሎ ተባዕተ ዘይፈትሕ ሕምሰ ወኵሎ በኵረ ውሉድየ እቤዙ ።
"And then he built chambers against all the house, five cubits high: and they rested on the house with timber of cedar.",ወአረፍተ ገቦሁ እምታሕቴሁ ኀምስ በእመት ርኅቡ ወለማእከላዊ ስድስ በእመት ወለሣልስኒ ስብዕ በእመት ርኅቡ እስመ አስተራሐቆ ለመኣዝነ ቤቱ ዘዐውዱ ከመ ኢይትቃረብ አረፍተ ቤቱ ።
A three-man crew lands safely after four months in the International Space Station.,እምነሰለስቱ ሰብእ ዘተመሥረተ ማህበር እምድኅረ አርባእቱ አውራህ በፅሐ ላዕለ መካነ ጠፈረ ዓለም ዘኩሉ።
"And when he went out the second day, behold, two men of the Hebrews strove together: and he said to him that did the wrong, Wherefore smitest thou thy fellow?",ወወፅአ በሳኒታ ዕለት ወረከበ ክልኤተ ዕደወ ዕብራዊያን እንዘ ይትጋደሉ ወይቤሎ ሙሴ ለዘይገፍዕ ለምንት ትዘብጦ ለካልእከ ።
"For this reason a man and a woman are to become one, and for this reason he leaves his father and his mother. He associates with his wife, and they become one flesh.",በእንተዝ ይኩን ብእሲ ወብእሲት አሐደ ወበእንተዝ የኀድግ አባሁ ወእሞ ወይፃመር ምስለ ብእሲቱ ወይከውኑ ሥጋ አሐደ።
"And wherefore hath the LORD brought us unto this land, to fall by the sword, that our wives and our children should be a prey? were it not better for us to return into Egypt?",ወለምንት ይወስደነ እግዚእ ውስተ ይእቲ ምድር ከመ ንደቅ በውስተ ቀትል ወአንስቲያነኒ ወደቂቅነሂ ይከውኑ ሕብልያ ወይእዜኒ ይኄይሰነ ንግባእ ውስተ ብሔረ ግብጽ ።
"And the king said unto him, Go in peace. So he arose, and went to Hebron.",ወይቤሎ ንጉሥ ሖር በሰላም ፤ ወተንሥአ ወሖረ ውስተ ኬብሮን ።
"Thou shalt not pervert the judgment of the stranger, nor of the fatherless; nor take a widow's raiment to pledge:",ወኢትሚጥ ፍትሐ ግዩር ወዘእጓለ ማውታ ወዘእቤር ።
Jesus stopped in his tracks and called to them. “What do you want me to do for you?” he asked.,ወቆመ እግዚእ ኢየሱስ ወጸውዖሙ ወይቤሎሙ ምንተ ትፈቅዱ እግበር ለክሙ።
"These things are an allegory: the women are two covenants. One is from Mount Sinai, which gives birth to slave children; this is Hagar.",ወዝ ውእቱ አምሳለ ክልኤቱ ሥርዓት ወአሐቲሰ እምደብረ ሲና ተወልደት ለቅኔ ወይእቲሰ አጋር።
"And not only that: we even take pride in God through our Lord Jesus Christ, the one through whom we now have a restored relationship with God.Grace now rules",አኮ በእንተ ዝንቱ ባሕቲቱ ዓዲ ንትሜካሕ በኀበ እግዚአብሔር በእንተ እግዚእነ ኢየሱስ ክርስቶስ ዘበእንቲኣሁ ረከብነ ሣህሎ።ዘከመ ቦአት ኀጢአት ውስተ ዓለም
And I will bring back all the people unto thee: the man whom thou seekest is as if all returned: so all the people shall be in peace.,ወእሚጦሙ ለኵሉ ሕዝብ ኀቤከ ከመ ትገብእ መርዓት ኀበ ምታ እስመ ነፍሰ ፩ብእሲ ዘተኀሥሥ አንተ ዳእሙ ወለባዕድሰ ለኵሉ ሰብእ ሰላም ።
"Then thine handmaid said, The word of my lord the king shall now be comfortable: for as an angel of God, so is my lord the king to discern good and bad: therefore the LORD thy God will be with thee.",ወትቤ ይእቲ ብእሲት እስመ ቃሉ ለእግዚአብሔር ከመ መሥዋዕት ወከመ መልአከ እግዚአብሔር ከማሁ ውእቱ እግዚእየ ንጉሥ ለሰሚዐ ሠናይ ወእኩይ ወእግዚአብሔር አምላክከ የሀሉ ምስሌከ ።
"The shepherds returned home, glorifying and praising God for all they had heard and seen. Everything happened just as they had been told.Jesus’ circumcision, naming, and temple presentation",ወተመይጡ ኖሎት እንዘ ይሴብሕዎ ወየአኵትዎ ለእግዚአብሔር በእንተ ኵሉ ዘርእዩ ወሰምዑ ዘከመ ይቤልዎሙ።ዘከመ ተገዝረ እግዚእ ኢየሱስ ወዘከመ አቀምዎ ውስተ ቤተ መቅደስ
"Thank God that I didn’t baptize any of you, except Crispus and Gaius,",አአኵቶ ለእግዚአብሔር ዘኢያጥመቁ እምውስቴትክሙ ዘእንበለ ቀርስጶስ ወጋይዮስ።
"Many people came to him. “John didn’t do any miraculous signs,” they said, “but everything John said about this man was true.”",ወብዙኃን ሖሩ ኀቤሁ ወይቤሉ ዮሐንስ አልቦ ዘገብረ ተአምረ ወኢምንተኒ ወባሕቱ ኵሉ ዘይቤ ዮሐንስ በእንተዝ ብእሲ እሙነ ኮነ።
"And they did eat and drink, he and the men that were with him, and tarried all night; and they rose up in the morning, and he said, Send me away unto my master.",ወእምዝ በልዑ ወሰትዩ ውእቱኒ ወእለ ምስሌሁ ወቤቱ ወተንሥኡ በጽባሕ ወይቤ ፈንውኒ ከመ እሑር ኀበ እግዚእየ ።
"And Joseph said unto him, This is the interpretation of it: The three branches are three days:",ወእስከ ሠላስ መዋዕል ይዜከረከ ፈርዖን ሢመተከ ወያገብአከ ውስተ ሊቀ ቀዳሕያን ወትሜጥዎ ጽዋዐ ለፈርዖን በእዴከ ከመ ቀዲሙ ሢመትከ አመ ውስተ ቀዳሕያን አንተ ።
"Of the tribe of Naphtali, Nahbi the son of Vophsi.",ወዘእምነገደ ንፍታሌም ናቢ ወልደ ያቢ ።
"Unto thee it was shewed, that thou mightest know that the LORD he is God; there is none else beside him.",ከመ ታእምር ከመ ውእቱ እግዚአብሔር አምላክ ወአልቦ ባዕደ እንበሌሁ ።
"That thou mightest fear the LORD thy God, to keep all his statutes and his commandments, which I command thee, thou, and thy son, and thy son's son, all the days of thy life; and that thy days may be prolonged.",ከመ ትፍርህዎ ለእግዚአብሔር አምላክክሙ ወከመ ትዕቀቡ ኵሎ ኵነኔሁ ወትእዛዞ ኵሎ ዘአነ እኤዝዘክሙ ዮም አንተ ወወልድከ ወደቂቀ ወልድከ በኵሉ መዋዕለ ሕይወትከ ከመ ይኑኅ መዋዕሊክሙ ።
"Or when the spirit of jealousy cometh upon him, and he be jealous over his wife, and shall set the woman before the LORD, and the priest shall execute upon her all this law.",ወለብእሲኒ ዘመጽአ ላዕሌሁ መንፈሰ ቀንእ ወቀንአ ላዕለ ብእሲቱ ወያቀውማ ለብእሲቱ ቅድመ እግዚአብሔር ወይገብር ላቲ ካህን ኵሎ ዘንተ ሕገ ።
"Then the manager said to another, ‘How much do you owe?’ He said, ‘One thousand bushels of wheat.’He said, ‘Take your contract and write eight hundred.’",ወይቤሎ ለካልኡሂ አንተሰ ሚመጠነ ትፈድዮ ለእግዚእየ ወይቤሎ ምእተ በመስፈርተ ቆሮስ ሥርናየ ወይቤሎ ናሁኬ መጽሐፍከ ንበር ወጸሐፍ ፍጡነ ሰማንያ ላዕሌከ።
"I will raise them up a Prophet from among their brethren, like unto thee, and will put my words in his mouth; and he shall speak unto them all that I shall command him.",ነቢየ ኣነሥእ ሎሙ እምውስተ አኀዊሆሙ ዘከማከ ወእሁብ ቃልየ ውስተ አፉሁ ወይነግሮሙ ዘከመ አዘዝክዎ ።
"The light was in the world,and the world came into being through the light,but the world didn’t recognize the light.",ወውስተ ዓለም ሀሎ ወዓለምኒ ቦቱ ኮነ ወዓለምሰ ኢያእመሮ።
"“Even upon my servants, men and women,”“I will pour out my Spirit in those days,”“and they will prophesy.”",ወላዕለ አግብርትየ ወአእማትየ እክዑ እምነ መንፈስየ ወይእተ አሚረ ይትኔበዩ።
so that the Law became our custodian until Christ so that we might be made righteous by faith.God’s children are heirs in Christ,ኦሪት እንከ መርሐ ኮነተነ ለኀበ ክርስቶስ ከመ ንጽደቅ በአሚን ቦቱ።
"“When the groom was late in coming, they all became drowsy and went to sleep.",ወጐንድዮ መርዓዊ ደቀሳ ኵሎን ወኖማ።
"And Zimri went in and smote him, and killed him, in the twenty and seventh year of Asa king of Judah, and reigned in his stead.",ወቦአ ዘንበሪ ወረገዞ ወቀተሎ ወነግሠ ህየንቴሁ ።
"How shall I curse, whom God hath not cursed? or how shall I defy, whom the LORD hath not defied?",ወምንተ እፄእል ዘእግዚአብሔር ኢፀአለ ወምንተ እረግም ዘእግዚአብሔር ኢረገመ ።
"Because all the firstborn are mine; for on the day that I smote all the firstborn in the land of Egypt I hallowed unto me all the firstborn in Israel, both man and beast: mine shall they be: I am the LORD.",ወነበቦ እግዚአብሔር ለሙሴ በሐቅለ ሲና ወይቤሎ ፤
"About forty thousand prepared for war passed over before the LORD unto battle, to the plains of Jericho.",፬፻-፻ቅኑታኒሆሙ ለቀትል ዐደዉ ቅድመ እግዚአብሔር ከመ ይትቃተልዋ ለኢያሪኮ ሀገር ።
"Therefore, the one who marries the unmarried woman does right, and the one who doesn’t get married will do even better.",ወዘኒ አውሰበ ድንግለ ሠናየ ገብረ ወዘሰ ኢያውሰበ እንተ ትኄይስ ገብረ።
"Abiezer the Anethothite, Mebunnai the Hushathite,",ሶሌ ዘተለዎ ለኢራሶ ወልደ ኤስኮ ቶቄያዊ ።
“I know that none of you will see me again—you among whom I traveled and proclaimed the kingdom.,ወይእዜኒ ናሁ አነ አእመርኩ ከመ ኢትሬኢዩኒ ገጽየ እንከ አንትሙ ኵልክሙ እለ ሰበኩ ለክሙ በእንተ መንግሥተ እግዚአብሔር።በእንተ አንቅሆ ኖሎት
Abel wished he had many things.,አቤል ተመነየ ከመ ይረክብ ብዙኃ ነገራት ።
"Then the fourth angel blew his trumpet, and a third of the sun was struck, and a third of the moon, and a third of the stars so that a third of them became dark. The day lost a third of its light, and the night lost a third of its light too.",ወሶበ ጠቅዐ ራብዕ መልአክ ተቀሥፈት ፀሓይ ወጸልመ ሣልስተ እዴሃ ወሣልስተ እዴሃ ለወርኅ ወሣልስተ እዴሆሙ ለከዋክብት ከመ ኢያብርሁ ወሣልስተ እዴሆሙ ለዕለት ወለሌሊት።
"Right then, in the middle of the night, the jailer welcomed them and washed their wounds. He and everyone in his household were immediately baptized.",ወነሥኦሙ ሶቤሃ በሌሊት ወኀፀቦሙ እምቅሥፈቶሙ ወተጠምቀ ውእቱኒ ወኵሉ ሰብኡ በጊዜሃ።
People are destined to die once and then face judgment.,ወበከመ ጽኑሕ ለሰብእ ምዕረ መዊት ወእምድኅሬሁ ደይን።
"Ye shall not steal, neither deal falsely, neither lie one to another.",ኢትስርቁ ወኢተሐስዉ ወአልቦ ዘይትአገል ካልኦ ።
Holy and mighty and blessed.,ቅዱስ ወሐየል ወቡሩክ ።
And all the days of Enos were nine hundred and five years: and he died.,ወኮነ ኵሉ መዋዕሊሁ ለሄኖስ ፱፻ወ፭ዓመተ ወሞተ ።
"If thou shalt keep all these commandments to do them, which I command thee this day, to love the LORD thy God, and to walk ever in his ways; then shalt thou add three cities more for thee, beside these three:",ለእመ ሰማዕከ ከመ ትግበር ኵሎ ዘንተ ትእዛዘ ዘአነ እኤዝዘከ ዮም ከመ ታፍቅሮ ለእግዚአብሔር አምላክከ ወከመ ትሑር በኵሉ ፍናዊሁ በኵሉ መዋዕል ወትዌስክ ለከ ዓዲ ሠላሰ አህጉረ ላዕለ እልክቱ ሠላስ ።
"Then king Rehoboam sent Adoram, who was over the tribute; and all Israel stoned him with stones, that he died. Therefore king Rehoboam made speed to get him up to his chariot, to flee to Jerusalem.",ወእምዝ ሶበ ሰምዑ ኵሉ እስራኤል ከመ አተወ ኢዮርብዓም እምግብጽ ወለአኩ ወጸውዕዎ ውስተ ማኅበሮሙ ወአንገሥዎ ላዕለ እስራኤል ወአልቦ ዘተለዎ ለቤተ ዳዊት ዘእንበለ በትረ ይሁዳ ወብንያም ባሕቲቶሙ ።
"The PM congratulated all Ethiopians in all corners of the country for finalizing a successful Green Legacy season this year with 6.7 billion seedlings planted, surpassing the set target.",መራሒሁ እምላዕለ ዘተሀለየ ስሳ ወሰብዓቱ ትእልፊታተ ተክላተ በተኪሎት በማዕዘናተ ኵሉ ሀገራት ለዘሀለዉ ኢትዮጵያውያን እንቋዕ ተፈሣክሙ ይቤሉ።
"And Atroth, Shophan, and Jaazer, and Jogbehah,",ወሶፋን ወያዜር ፤
Those who belong to Christ Jesus have crucified the self with its passions and its desires.,ወእለሰ በኢየሱስ ክርስቶስ ሰቀሉ ሥጋሆሙ ምስለ ፍትወት ወምስለ ኀጢአት።
David also took Ahinoam of Jezreel; and they were also both of them his wives.,ወነሥአ ለአኪናሖም እምውስተ ኢይዝራኤል ወክልኤሆን ኮና አንስቲያሁ ።
Jacob said: ‘I will do everything just as you ordered me because this matter will be something honorable and great for me; it will be a righteous act for me before the Lord that I should honor them.,ወይቤ ያዕቆብ አነ እገብር ኵሎ ዘከመ አዘዝክኒ እስመ ክብር ወዕበይ ሊተ ዝንቱ ነገር ወጽድቅ ሊተ በቅድመ እግዚአብሔር ከመ አክብሮሙ።
"And God heard the voice of the lad; and the angel of God called to Hagar out of heaven, and said unto her, What aileth thee, Hagar? fear not; for God hath heard the voice of the lad where he is.",ወሰምዐ እግዚአብሔር አውያቶ ለውእቱ ሕፃን እምነ ብሔር ኀበ ሀሎ ወጸውዐ መልአከ እግዚአብሔር ለአጋር እምሰማይ ወይቤላ ምንተ ኮንኪ አጋር ኢትፍርሂ እስመ ሰምዐ እግዚአብሔር ቃሎ ለሕፃንኪ እምውስተ መካን ኀበ ሀሎ ።
"And Elijah said, As the LORD of hosts liveth, before whom I stand, I will surely shew myself unto him to day.",ወይቤሎ ኤልያስ ሕያው እግዚአብሔር አምላከ ኀይል ዘቆምኩ ቅድሜሁ ከመ ዮም ኣስተርእዮ ።
"The child began to realize the errors of the earth — that everyone was going astray after the statues and after impurity. His father taught him (the art of) writing. When he was two weeks of years [= 14 years], he separated from his father in order not to worship idols with him.",ወአኀዘ ሕፃን ያእምር ስሕተተ ምድር ከመ ኵሉ ይስሕት በድኅሬሆሙ ለግልፎ ወድኅረ ርኵስ ወመሀሮ አቡሁ መጽሐፈ ወወልደ ክልኤ ሱባዔ ዓመት ውእቱ ወተፈልጠ እምድኅረ አቡሁ ከመ ኢይስግድ ምስሌሁ ለጣዖት።
"And when Samuel had caused all the tribes of Israel to come near, the tribe of Benjamin was taken.",ወአብአ ሳሙኤል ኵሎ አብትሪሆሙ ወበጽሐ ላዕለ በትረ ብንያም ።
"And thou shalt offer every day a bullock for a sin offering for atonement: and thou shalt cleanse the altar, when thou hast made an atonement for it, and thou shalt anoint it, to sanctify it.",ወላህመ ዘእንበይነ ኀጢአት ትገብር በዕለት በዘ ቦቱ ታነጽሕ መሥዋዕተ ሶበ ትቄድስ ቦቱ ወትቀብኦ ።
And Sarah was an hundred and seven and twenty years old: these were the years of the life of Sarah.,ወኮነ ሕይወታ ለሳራ ፻ወ፳ወ፯ዓመተ ።
"And now whereas my father did lade you with a heavy yoke, I will add to your yoke: my father hath chastised you with whips, but I will chastise you with scorpions.",ወመጽኡ ኵሉ እስራኤል ኀበ ሮብዓም ንጉሥ አመ ሣልስት ዕለት በከመ ይቤሎሙ ንጉሥ ግብኡ ኀቤየ እስከ ሣልስት ዕለት ።
Don’t suppress the Spirit.,መንፈሰ ኢታጥፍኡ።
"However, he found out about their scheme. They were keeping watch at the city gates around the clock so they could assassinate him.",ወአእመሮሙ ሳውል ምክሮሙ ዘይፈቅዱ ይግበሩ ላዕሌሁ ወየዐቅቡ አናቅጸ ሀገር መዓልተ ወሌሊተ ከመ ይቅትልዎ።በእንተ ሑረቱ ኢየሩሳሌም
"But ye shall offer a burnt offering, a sacrifice made by fire, of a sweet savour unto the LORD: one bullock, one ram, seven lambs of the first year without blemish:",ወአብኡ መሥዋዕተ ቍርባን ለመዐዛ ሠናይ ለእግዚአብሔር ላህመ አሐደ ወበግዐ አሐደ ለመሥዋዕት ወመሖስአ አባግዕ ዘዘ ዓመት ንጹሓነ ሰብዐተ ።
"Then Isaac said to him: ‘Come close and let me touch you, my son, (so that I can tell) whether you are my son Esau or not’.",ወይቤሎ ይስሐቅ ቅረብ ወእግሥሥከ ወልድየ እመ አንተ ወልድየ ዔሳው ወእመ ኢኮነሁ።
"And if a man shall lie with a woman having her sickness, and shall uncover her nakedness; he hath discovered her fountain, and she hath uncovered the fountain of her blood: and both of them shall be cut off from among their people.",ወብእሲኒ ለእመ ሰክበ ምስለ ብእሲት ትክት ወከሠተ ኀፍረታ ወከሠተ ነቅዓ ወይእቲነ ከሠተት ክዕወተ ደማ ለይሠረዉ ክልኤሆሙ እምነ ሙላዶሙ ።
"Then Joshua called the Reubenites, and the Gadites, and the half tribe of Manasseh,",ወእምዝ ጸውዖሙ ኢየሱስ ለደቂቀ ሮቤል ወለደቂቀ ጋድ ወለመንፈቀ ነገደ መናሴ ።
Bring in your kingdom so that your will is done on earth as it’s done in heaven.,ትምጻእ መንግሥትከ ወይኩን ፈቃድከ በከመ በሰማይ ከማሁ በምድር።
"“Then those servants went to the roads and gathered everyone they found, both evil and good. The wedding party was full of guests.",ወወፂኦሙ እሙንቱ አግብርት ውስተ ፍናው አስተጋብኡ ኵሎ ዘረከቡ እኩያነ ወኄራነ ወመልአ ቤተ በዓል እምእለ ይረፍቁ።
You remained in the court for three weeks of years [ = 21 years] until the time when you went from the royal court and saw the Egyptian beating your companion who was one of the Israelites. You killed him and hid him in the sand.,ወሀለውከ ውስተ ዐጸድ ሠለስተ ሱባዔ ዓመት እስከ መዋዕል አመ ወፃእከ እምዐጸደ መንግሥት ወርኢኮ ለግብጻዊ እንዘ ይዘብጦ ለካልእከ ዘእምነ ውሉደ እስራኤል ወቀተልኮ ወኀባእኮ ውስተ ኆጻ።
"Peter and those with him were almost overcome by sleep, but they managed to stay awake and saw his glory as well as the two men with him.",ወረከበ ጴጥሮስሃ ወእለ ምስሌሁ ክቡዳን አዕይንቲሆሙ በድቃስ ወነቂሖሙ ርእዩ ስብሐቲሁ ወዕደወኒ ክልኤተ እለ ይቀውሙ ምስሌሁ።
"Jesus replied, “Isn’t it written in your Law, I have said, you are gods?",ወአውሥአ እግዚእ ኢየሱስ ወይቤሎሙ አኮኑ ጽሑፍ ውስተ ኦሪትክሙ «አንሰ እቤ አማልክት አንትሙ።»
"This is why I speak to the crowds in parables: although they see, they don’t really see; and although they hear, they don’t really hear or understand.",ወበእንተ ዝንቱ በአምሳል እትናገሮሙ እስመ እንዘ ይሬእዩ ኢይሬእዩ ወእንዘ ይሰምዑ ኢይሰምዑ ወኢይሌብዉ።
Former Prime Minister of Thailand Yingluck Shinawatra appears in court to face corruption charges.,ዘቀዳሚሁ ዘታይላንድ መራሒ ይንግሉክ ሺናዋራ በሙስና ተናፊቆሙ ቤተ ብያኔ ቀርቡ።
"So what are we going to say? That the Law is sin? Absolutely not! But I wouldn’t have known sin except through the Law. I wouldn’t have known the desire for what others have if the Law had not said, “Don’t desire to take what others have”.",ምንተ እንከ ንብል ኀጢአትኑ ይእቲ ኦሪት ሐሰ ወባሕቱ እምኢያእመርክምዋ ለኀጢአት ሶበ ኢመጽአት ኦሪት ወለፍትወትኒ እምኢያእመርክምዋ ግሙራ ሶበ ኢትቤ ኦሪት ኢትፍቱ።
"And Jacob said, Swear to me this day; and he sware unto him: and he sold his birthright unto Jacob.",ወይቤሎ ያዕቆብ መሐልኬ ሊተ ዮም ከመ ታግብእ ሊተ በኵረከ ወመሐለ ሎቱ ዔሳው ወአግብአ ሎቱ ለያዕቆብ ከዊነ በኵር ።
"Besides the cakes, he shall offer for his offering leavened bread with the sacrifice of thanksgiving of his peace offerings.",ምስለ ኅብስት ዘብሑእ ያመጽእ ቍርባኖ ለመሥዋዕተ አኰቴት ዘመድኀኒቱ ።
And the priest shall sprinkle with his right finger some of the oil that is in his left hand seven times before the LORD:,ወይነዝኅ ካህን በአጽባዕቱ እንተ የማን እምነ ውእቱ ቅብእ ዘውስተ እዴሁ እንተ ጸጋም ስብዕ ቅድመ እግዚአብሔር ።
But I say to you that whoever divorces his wife except for sexual unfaithfulness forces her to commit adultery. And whoever marries a divorced woman commits adultery.Law of solemn pledges,ወአንሰ እብለክሙ ኵሉ ዘይድኅር ብእሲቶ ዘእንበለ ትዘሙ በላዕሌሁ ለሊሁ ረሰያ ዘማ ወዘሂ ኅድገተ አውሰበ ዘመወ።
"When the LORD thy God hath cut off the nations, whose land the LORD thy God giveth thee, and thou succeedest them, and dwellest in their cities, and in their houses;",ወለእመ አጥፍኦሙ እግዚአብሔር አምላክከ ለአሕዛብ እለ ይሁበከ እግዚአብሔር ምድሮሙ ወተወረስክምዎሙ ወነበርክሙ ውስተ ምድሮሙ ወውስተ አህጉሪሆሙ ወውስተ አብያቲሆሙ ፤
"He created the heavens, the earth, and everything that was created in six days. The Lord gave a holy festal day to all his creation. For this reason he gave orders regarding it that anyone who would do any work on it was to die; also, the one who would defile it was to die.",ፈጠረ ሰማየ ወምድረ ወኵሎ ዘተፈጥረ በሰዱስ ዕለት ወወሀበ እግዚአብሔር ዕለተ በዓል ቅድስተ ለኵሉ ምግባሩ በእንተዝ አዘዘ በእንቲአሃ ኵሉ ዘይገብር ባቲ ኵሎ ግብረ ይሙት ወዘኒ ያረኵሳ ሞተ ለይሙት።
"The independent satellite channel is currently producing 12 different programmes, incorporating psychology, law, music and drama, the publication reported.",አግአዚ እንተ ሳተላይት ምህዋር በዝ ሰአት ስነ ልቡና ወህግ ወሀልዮ ተውኔት ህቡራነ አሰርተ ወክልኤተ ዘገበ ከመ ለእለ ገብረ።
"And it came to pass, when he had made an end of speaking, that he cast away the jawbone out of his hand, and called that place Ramathlehi.",ወእምዝ ሶበ አኅለቀ ነቢበ ገደፋ ለይእቲ ዐጽመ መንከስ እምነ እዴሁ ወሰመዮ ለውእቱ መካን ቀትለ ዐጽመ መንከስ ።
Some people brought children to Jesus so that he would place his hands on them and pray. But the disciples scolded them.,ወእምዝ አምጽኡ ሎቱ ሕፃናተ ከመ ያንብር እዴሁ ላዕሌሆሙ ወይጸሊ ወገሠጽዎሙ አርዳኢሁ።
And hast not suffered me to kiss my sons and my daughters? thou hast now done foolishly in so doing.,ወሚመ ኢይደልወኒኑ ከመ እስዐም ደቂቅየ ወአዋልድየ ወይእዜሰ ከመ አብድ ገበርከ ።
